{
  "contract_version": "1.0",
  "trace_id": "trace-demo-001",
  "stage_id": "05_testing",
  "from_agent": "tester",
  "to_agent": "pm",
  "created_at": "2026-04-23T09:50:00Z",
  "status": "submitted",
  "review_required": true,
  "reviewer_agent": "pm",
  "artifacts": {
    "input_refs": ["stages/05_testing/input/handoff_from_dev.json"],
    "output_refs": [
      "stages/05_testing/output/test_plan.md",
      "stages/05_testing/output/test_cases.md",
      "stages/05_testing/output/bug_report.md",
      "stages/05_testing/output/quality_summary.md"
    ]
  }
}
