{
  "contract_version": "1.0",
  "trace_id": "trace-demo-001",
  "stage_id": "01_requirements",
  "from_agent": "po",
  "to_agent": "po",
  "created_at": "2026-04-23T09:00:00Z",
  "status": "submitted",
  "review_required": false,
  "artifacts": {
    "input_refs": ["stages/01_requirements/input/brief.md"],
    "output_refs": ["stages/01_requirements/input/brief.md"]
  },
  "extensions": {
    "initiator": "human"
  }
}
