{
  "contract_version": "1.0",
  "trace_id": "trace-demo-001",
  "stage_id": "01_requirements",
  "from_agent": "po",
  "to_agent": "ba",
  "created_at": "2026-04-23T09:10:00Z",
  "status": "submitted",
  "review_required": true,
  "reviewer_agent": "ba",
  "artifacts": {
    "input_refs": [
      "stages/01_requirements/input/brief.md"
    ],
    "output_refs": [
      "stages/01_requirements/output/product_vision.md",
      "stages/01_requirements/output/user_stories.md",
      "stages/01_requirements/output/backlog_prioritized.md"
    ]
  }
}
