{
  "contract_version": "1.0",
  "trace_id": "trace-demo-001",
  "stage_id": "03_design",
  "from_agent": "designer",
  "to_agent": "developer",
  "created_at": "2026-04-23T09:30:00Z",
  "status": "submitted",
  "review_required": true,
  "reviewer_agent": "developer",
  "artifacts": {
    "input_refs": ["stages/03_design/input/handoff_from_ba.json"],
    "output_refs": [
      "stages/03_design/output/user_journey.md",
      "stages/03_design/output/wireframes.md",
      "stages/03_design/output/design_system.md",
      "stages/03_design/output/prototype_notes.md"
    ]
  }
}
