{
  "contract_version": "1.0",
  "trace_id": "trace-demo-001",
  "stage_id": "02_analysis",
  "from_agent": "ba",
  "to_agent": "designer",
  "created_at": "2026-04-23T09:20:00Z",
  "status": "submitted",
  "review_required": true,
  "reviewer_agent": "designer",
  "artifacts": {
    "input_refs": ["stages/02_analysis/input/handoff_from_po.json"],
    "output_refs": [
      "stages/02_analysis/output/srs.md",
      "stages/02_analysis/output/business_flow.md",
      "stages/02_analysis/output/data_dictionary.md"
    ]
  }
}
